ID,Title,Body,Cover_image,Equipment,Type_of_support,Child_age,Domain,Related_milestones,Mandatory_content,Translation_language,Moderation_state
7471,Мячи в коробке,"<p><strong>Необходимые материалы: </strong>Несколько мячей разного размера (это могут быть мячи для софтбола, которые вы сделали из свернутых носков или газет); картонная коробка размером больше самого большого шара.</p>

<p><strong>Что вы можете делать вместе: </strong>Установите игру в помещении (если мячи мягкие) или на улице. Предложите ребенку попробовать забросить мяч в коробку. Начните с того, что покажите ребенку, как это делать, и сначала встаньте очень близко к коробке. Когда ребенок научится метать, предложите ему отойти дальше. Попробуйте это с мячами разного размера. Вашему ребенку тоже понравится делать это самому.  Если ребенку интересно, вы также можете посчитать, сколько раз он или она попадает мячом в коробку.  </p>

<p><strong>Что изучает ваш ребенок: </strong>В этой и других играх ваш ребенок развивает свои физические навыки. Ребенок учится контролировать свои движения, чтобы делать точные броски.  Если вы станете более компетентным в этом навыке, ваш ребенок будет уверен в себе. Если вы добавите в игру счет, ваш ребенок также улучшит свои ранние математические способности.</p>",12666,yes,parent,,6436,7026,1,ru,published
7476,Куда лучше всего пнуть?,"<p><strong>Необходимые материалы: </strong>Один или несколько мячей (если у вас нет мячей, вы можете сделать их из мятой бумаги или свернутых носков); Картонная коробка размером больше, чем мячи; Другие цели, по которым ваш ребенок может ударить мячом (например, палка, лежащая на земле)</p>

<p><strong>Что вы можете делать вместе: </strong>Пригласите ребенка поиграть в игру: «Ты умеешь пинать мяч? Хорошо! А теперь попробуем что-нибудь посложнее. Сможешь ли ты встать здесь и забить мяч в эту коробку? (коробка перевернута на бок открытым концом к ребенку). Используйте только ноги, а не руки. Попробуй еще раз, это непросто! Может, ты подойдешь поближе». Ваши предложения зависят от навыков и интересов вашего ребенка. Вы можете усложнить задачу: «А теперь давай попробуем что-нибудь другое. Сможешь ли ты встать здесь и пнуть мяч так, чтобы он докатился до этой палки? Ух ты, отличный удар!»</p>

<p><strong>Чему при этом учится ребенок: </strong>Теперь ваш ребенок развивает более продвинутые физические навыки. Это и подобные упражнения помогут вашему ребенку научиться контролировать свои движения. Ваш ребенок также развивает свои мыслительные способности, поскольку ваш ребенок планирует, насколько сильно ударить по мячу или какой угол будет лучше всего, чтобы мяч оказался в коробке.</p>",12671,yes,parent,,6436,7031,1,ru,published
7481,Рисование Мелом На Открытом Воздухе,"<p><strong>Необходимые материалы: </strong>Гигантские мелки для тротуаров</p>

<p><strong>Что вы можете делать вместе: </strong>Предоставьте детям несколько гигантских мелков разных цветов, чтобы они могли рисовать. Скорее всего, они точно знают, что им нравится рисовать и где, но вот несколько идей, с которых они могут начать:</p>

<ul>
	<li>Если у вас есть мощеная подъездная дорога или внутренний дворик, залейте каждую плиту разным цветом.</li>
	<li>На некоторых тротуарных плитках нарисуйте крестики и наступайте на плитки без крестов.</li>
	<li>Нарисуйте сетку классиков вместе, чтобы можно было весело скакать и прыгать!</li>
	<li>По очереди создавайте извивающиеся лабиринты, ведущие к клумбам и горшечным растениям.</li>
	<li>Лягте на землю и обведите друг друга мелом, затем встаньте и завершите картину, нарисовав волосы, лицо и одежду.</li>
</ul>

<p>Поощряйте детей рисовать на открытом воздухе, если вы хотите, чтобы дождь смыл за вас весь мел!</p>

<p><strong>Чему при этом учится ребенок</strong>: Рисование мелом на улице позволяет детям исследовать и чувствовать свободу. Это также помогает малышам развивать мелкую моторику - что является идеальным для подготовки к школе!</p>",12676,yes,parent,,6436,7036,1,ru,published
7486,"""Я пошел на рынок""","<p><strong>Необходимые материалы: </strong>Отсутствуют</p>

<p><strong>Что вы можете делать вместе: </strong>Один игрок начинает со слов: «Я пошел сегодня на рынок и купил… [называет предмет]». Следующий игрок должен добавить свой собственный предмет, вспомнив при этом предыдущий, в том же порядке. Игроки по очереди продолжают добавлять новые названия предметов в список. Продолжайте добавлять и вспоминать названия, пока кто-нибудь не совершит ошибку - тогда вы сможете начать все заново!</p>

<p>Эта игра не должна ограничиваться «рынком»! Как насчет того, чтобы попробовать разные варианты, например, пляж или необитаемый остров?</p>

<p><strong>Что изучает ваш ребенок:  </strong>Это задание - отличный тест на память для детей, которые пытаются вспомнить названия предметов, из постоянно расширяющегося списка. Это отличная социальная игра как для маленьких, так и для больших групп, она обязательно укрепит у детей уверенность в публичных выступлениях!</p>",12021,no,parent,,6441,7041,1,ru,review_after_translation
7491,Разыгрывание книги,"<p> </p>

<p><strong>Необходимые материалы: </strong>Отсутствуют</p>

<p><strong>Что вы можете делать вместе: </strong>Спросите детей, не хотели бы они придумать свои собственные книги для разыгрывания или выбрать названия знакомых им книг из шляпы.</p>

<p>Вот некоторые популярные варианты:</p>

<ul>
	<li><em>Очень голодная гусеница</em> (съесть всю еду, закрутиться в кокон и превратиться в бабочку)</li>
	<li><em>Груффало</em> (почувствуйте шипы на спине и ядовитую бородавку на кончике носа)</li>
	<li><em>Где</em> обитают дикие существа (рычите, топайте и станьте «королем всех диких существ», прежде чем отправиться домой на горячий ужин)</li>
	<li><em>Алиса в стране чудес</em> (представьте, что упали в кроличью нору, сделайте глоток из бутылки «Выпей меня» и уменьшитесь, чтобы пройти через дверь)</li>
	<li><em>Питер Пэн</em> (летите в Неверленд и сражайтесь на мечах с Капитаном Крюком)</li>
</ul>

<p>Остальные игроки должны угадать название книги, и тот, кто первым угадывает правильно, делает следующий ход.</p>

<p>Для юных игроков выберите вместе четыре или пять книг и попросите их угадать, какая из них разыгрывается. Им также может понравиться разыгрывать свою книгу с помощью взрослых.</p>

<p><strong>Что изучает ваш ребенок:  </strong>Это задание идеально подходит для того, чтобы укрепить уверенность ребенка и развить его воображение, когда он разыгрывает свои любимые сборники сказок. Другие игроки должны быть особенно внимательными, чтобы угадать название книги - отлично подходит для отработки навыков слушания и концентрации.</p>",12681,no,parent,,6441,7046,1,ru,review_after_translation
7496,Моя Песня Про Адрес,"<p><strong>Необходимые материалы: </strong>Имя и адрес вашего ребенка, напечатанные большими буквами на листе бумаги (пока это может быть просто почтовый адрес).</p>

<p><strong>Что вы можете делать вместе: </strong>Предложите ребенку составить с вами особую песню. «Это будет особенная песня с ТВОИМ именем и ТВОИМ адресом - место, где мы с тобой живем! Мы можем спеть эту песню вместе и спеть ее папе (или другому члену семьи) позже».</p>

<p>Используйте простые слова примерно так и добавляйте их к знакомой мелодии - вообще к чему угодно:</p>

<p>Я Мария, я Мария, это мое имя, это мое имя!</p>

<p>Я живу на улице Лила, 3, я живу на улице Лила, 3.</p>

<p>Это мой адрес, это мой адрес!</p>

<p>Спойте песню вместе. При этом вы можете указать на письменное имя и адрес вашего ребенка. Повторяйте это часто, выполняя задания дома или гуляя вместе. Через некоторое время ваш ребенок сможет спеть ее самостоятельно.</p>

<p><strong>Чему при этом учится ребенок: </strong>Когда ваш ребенок готовится к школе, важно знать свое имя и адрес. Песни помогают детям запомнить многое, не только имя и адрес, но и буквы алфавита и другую информацию. Запоминание песни также развивает у вашего ребенка навыки мышления, а совместное сочинение песни укрепляет ваши отношения.</p>",12686,yes,parent,,6436,7051,1,ru,published
7501,Счет  природы,"<p><strong>Необходимые материалы: </strong>Планшет с зажимом для бумаги, бумага, карандаш.</p>

<p><em>Вспомогательное дополнительное оборудование: </em>Увеличительное стекло, бинокль.</p>

<p><strong>Что вы можете делать вместе: </strong>Выведите своего ребенка/детей на улицу, чтобы исследовать мир природы. Какие виды растений и животных они могут заметить? Заставьте их остановиться, посмотреть в разных местах и записать свои захватывающие находки - от верхушек деревьев до мест под камнями и скалами. Они могут записывать свои находки по-разному. Может быть, им удастся составить таблицу, в которой будут подсчитаны все растения, которые они найдут? Или, может быть, им понравится рисовать и маркировать обнаруженных животных и насекомых? Еще один интересный вариант - представить игру на запоминание: предложите им выучить список различных животных / насекомых/растений/птиц, которых они замечают, и посмотреть, будут ли они повторять его вслух. Например: «Сегодня насчитал пять уток, трех бабочек, одну лягушку, двух божьих коровок…». Самое главное, чтобы они получали массу удовольствия, узнавая об окружающем мире!</p>

<p>На одной квадратной миле пустого поля насекомых больше, чем людей в мире!</p>

<p><strong>Чему при этом учится ребенок: </strong>Убедить вашего ребенка исследовать, называть и считать диких животных, которые они могут увидеть - это задорный вызов для их чувств, который раскрывает впечатляющее разнообразие растений и животных, живущих вокруг них. Это отличный способ пополнить свой словарный запас и улучшить навыки счета!</p>",12081,yes,parent,,6441,7056,1,ru,published
7506,Семейные Фотографии,"<p><strong>Необходимые материалы: </strong>Семейные фотоальбомы</p>

<p><strong>Что вы можете делать вместе</strong>: Для детей младшего возраста, которые привыкли к цифровой фотографии, старые семейные альбомы - это реальный способ рассказать им об истории своей семьи!</p>

<p>Найдите время, чтобы сесть вместе и просмотреть старые семейные фотографии, указывая на людей, которых они, возможно, знают или узнают на фотографиях. Вы можете просмотреть несколько фотоальбомов на кухонном столе или просмотреть одну или две отдельные фотографии, уютно устроившись на диване.</p>

<p>Детям понравится угадывать личности детей на фотографиях, и они могут быть удивлены тем, насколько бабушка или дедушка были похожи на них, когда они были маленькими! Попробуйте найти фотографии трех или четырех поколений вашей семьи в одном возрасте и сравните их на предмет сходства. Возможно, вам придется объяснить, что когда-то фотографии делались только в черно-белом цвете!</p>

<p>Забавное занятие - найти семейную фотографию, сделанную, когда вы все были моложе, и попытаться воссоздать ее сегодня. Распечатайте фотографии и положите их рядом - результат обязательно вызовет у вас улыбку!</p>

<p><strong>Что изучает ваш ребенок:  </strong>Найдите свои старые фотоальбомы и соберитесь с детьми, родителями, бабушками и дедушками, чтобы совершить путешествие по времени. Это упражнение побуждает детей задуматься о жизни своей семьи до того, как они появились в ней, одновременно развивая их эмоциональные и социальные навыки и чувство принадлежности. Это занятие также идет рука об руку с созданием генеалогического дерева!</p>",12131,yes,parent,,6436,7066,1,ru,review_after_translation
7511,Цветная охота,"<p><strong>Необходимые материалы: </strong>Мелкие предметы, каждый одного цвета (например, красный носок или апельсин).</p>

<p><strong>Что вы можете делать вместе: </strong>Предложите ребенку сыграть в игру «Охота за цветом». «Посмотри!  Вот <em>красный</em> носок. Можешь ли ты найти другие вещи <em>красного</em> цвета? Давай вместе посмотрим!» Исследуйте разные части своего дома или отправляйтесь на охоту на свежий воздух. Чаще используйте слова, обозначающие цвета.  </p>

<p>Позже занимайтесь охотой за цветом в поисках предметов другого цвета. Включите фиолетовый, оранжевый, коричневый, так ваш ребенок выучит больше цветов. По мере того, как он или она узнает больше, вы можете попросить своего ребенка найти предметы определенного цвета, не сравнивая его с другим цветом, или спросить, какой цвет он или она хочет искать. </p>

<p>Помимо этой игры, помогите своему ребенку выучить цвета, просто используя их названия в повседневном разговоре (приготовление пищи: «Сейчас я почищу эти желтые бананы» или одевание: «Давай найдем твою фиолетовую рубашку, чтобы надеть ее сегодня»).</p>

<p><strong>Что изучает ваш ребенок: </strong>Знание цветов - важная часть подготовки к школе. Мышление вашего ребенка развивается по мере того, как он усваивает представление о том, что предметы могут выглядеть по-разному, но иметь один и тот же цвет - и что похожие предметы, например, шляпы могут быть разных цветов.</p>",12691,yes,parent,,6436,7061,1,ru,published
7516,Играем в магазин,"<p><strong>Что вам понадобится: </strong>Различные бытовые предметы, чтобы их «продавать» в магазине; Монеты, жетоны или фишки; Стикеры; Ручка или карандаш; Калькулятор (необязательно)</p>

<p><strong>В чем заключается занятие: </strong>Соберите для магазина разные предметы - это может быть что угодно: от игрушек, книг и дисков до одежды, консервов и фруктов. Пусть дети сделают ценники на стикерах. Интересно, какую цену они назначат за каждую вещь? Вместо денег можно использовать фишки, жетоны или даже стеклянные бусины (нужно просто что-то, что дети смогут обменять на «товары»).</p>

<p>Затем решите, кто будет играть роль продавца, а кто будет покупателем. Если вы играете с настоящими деньгами, распределите монеты так, чтобы покупатели могли выбирать себе покупки, а продавец мог давать сдачу.</p>

<p>Пусть покупатели решают, сколько чего они в состоянии купить и сколько денег они готовы потратить. Продавец подсчитывает итоговую сумму (в уме, на бумаге или с помощью калькулятора), берет деньги и отсчитывает сдачу.</p>

<p>Пусть дети меняются ролями. Пусть выбирают разные товары для покупки и продажи и практикуются складывать и вычитать числа!</p>

<p><strong>Чему при этом учится ребенок: </strong>Ролевые игры - это прекрасный способ стимулировать развитие у малышей воображения, социальных навыков и уверенности в себе. Кроме того, игра в магазин дает детям возможность закрепить арифметические знания и потренироваться обращаться с деньгами.</p>",12696,yes,parent,,6441,7071,1,ru,published
