ID,Title,Body,Cover_image,Equipment,Type_of_support,Child_age,Domain,Related_milestones,Mandatory_content,Translation_language,Moderation_state
7331,Мяч в корзине,"<p><strong>Необходимые материалы: </strong>Один небольшой мячик, но можно использовать и свернутый в шар толстый носок; большая коробка или тазик, или большая корзина.  </p>

<p><strong>В чем заключается занятие: </strong>Поставьте коробку или корзину по центру комнаты, сами встаньте на небольшом расстоянии от нее. Чтобы привлечь внимание ребенка, можете первой бросить мяч в корзину, делайте это так, чтобы было видно, что вам весело. Подойдите поближе, чтобы было легче попадать. Когда ребенок заинтересуется, дайте ему/ей попробовать бросить самому/самой. В этом возрасте некоторым детям может быть сложно попадать в корзину, но даже если у них не получается забрасывать мяч, ценность и удовольствие от этого занятия заключается в отработке метательного движения. Подбадривайте ребенка при каждом его/ее броске словами, улыбкой, аплодисментами и восклицаниями. Попробуйте бросать по очереди (объясняйте: «Моя очередь! Теперь твоя очередь!» и проговаривайте, что вы делаете: «Отличный бросок!» или «О, у тебя мяч попал на диван; давай за ним!») и болейте за малыша при каждом броске, независимо от успеха. </p>

<p><strong>Чему при этом учится ребенок: </strong>Ваш ребенок развивает крупную моторику и координацию движений, повторяя за вами. Играя с вами, ребенок также учится тому, что значит делать что-то по очереди.</p>",3191,yes,parent,,6421,2956,1,ru,published
7336,Смотрим и играем вместе,"<p><strong>Что понадобится: </strong>Несколько интересных, безопасных игрушек или предметов дома или на улице</p>

<p><strong>В чем заключается занятие: </strong>В этом возрасте ваш ребенок начинает больше интересоваться другими детьми и хотеть взаимодействовать с ними. Ему может быть пока сложно играть с другими детьми в сложные игры, но ему может нравиться заниматься чем-то, просто находясь рядом, бок о бок с другим ребенком, и наблюдать за тем, что делает этот ребенок. Подумайте, с кем бы мог поиграть ваш малыш — быть может с кем-то из соседей или с детьми его возраста на площадке или в парке. Или, может быть, его брат или сестра составят ему компанию в его играх и занятиях. </p>

<p>Пусть дети расположатся рядом друг с другом, а вы разложите рядом несколько игрушек (достаточно, чтобы хватали обоим). Можете дать каждому ребенку несколько предметов и сказать что-нибудь вроде: «Смотри! Можете вместе поиграть. Видишь, твой друг стучит ложкой по кастрюле. А тебе что хочется делать?». Дети могут заниматься чем угодно, не обязательно деятельно взаимодействуя друг с другом, но они точно будут следить и интересоваться, что делает их сверстник. Пусть играют как хотят и во что хотят. Просто следите, чтобы все было безопасно, и предлагайте новые игрушки и предметы, показывая, как их можно использовать.</p>

<p><strong>Чему при этом учится ребенок: </strong>Это называется «параллельной игрой» — когда очень маленькие дети начинают играть рядом друг с другом, но в большинстве случаев каждый ребенок занимается своим делом. Они учатся, наблюдая за другими, а иногда повторяя то, что делает ребенок рядом. Это самое начало совместных игры и дружбы — важнейших компонентов детства.</p>",12561,yes,parent,,6431,2946,1,ru,published
7341,Дети любят разговаривать со взрослыми,"<p><strong>Необходимые материалы: </strong>Не потребуются.</p>

<p><strong>В чем заключается занятие: </strong>Детям нравится разговаривать со взрослыми. Всякий раз, когда у вас есть возможность, начинайте разговор, повторяя звук, издаваемый вашим ребенком (будь то слово, восклицание или просто какой-то звук), затем подождите, дайте ребенку время отреагировать — повторить за вами или снова что-то произнести, так у вас начнется разговор. Далее можете предлагать малышу новые слова и сочетания звуков, призывая его повторять за вами — например, «Муууу», «Корова мычит: мууу», «Давай, скажи муууу!». Всегда поддерживайте и хвалите ребенка, а затем, по возможности, изучайте другие звуки и слова — звуки ветра, дождя, шелест листвы, звук воды в ванной, звуки шагов по полу, дверного звонка...</p>

<p>Вы можете использовать это занятие где и когда угодно — во время игр и просто в свободное время, но также при повседневных делах — когда одеваетесь, готовите еду, умываетесь, делаете покупки, гуляете или едете куда-то. Кроме того, не забывайте постоянно разговаривать, читая или рассматривая книги: «Так, а что делает девочка? А что здесь? Смотри, тут много собак. Интересно, как они лают?».</p>

<p><strong>Чему при этом учится ребенок: </strong>Общаясь с вами, ваш ребенок учится использовать комбинации слов и узнает новые слова, обогащает свой словарный запас. </p>",10586,no,parent,,6441,2891,1,ru,published
7346,Давай разоваривать!,"<p><strong>Необходимые материалы:</strong> Отсутствуют.</p>

<p><strong>В чем заключается занятие: </strong>В этом возрасте у ребенка быстро развиваются языковые навыки. Вы даете вашему ребенку дома множество возможностей использовать звуки и слова для общения. Вы  все больше и больше понимаете друг друга! Если получается, давайте вашему ребенку возможность общаться с другими людьми: бабушками и дедушками (лично или по видеосвязи), соседями или продавцами в магазинах. В какой-то момент ваш ребенок начнет попытаться что-то сказать этим людям. Помогите ему, задавая наводящие вопросы, например: «Смотри, сколько фруктов. Что нам купить?». Если ваш ребенок что-то произносит в ответ, повторите его слова, дополните и обратитесь к продавцу. Ситуации могут быть самыми разными. Ваш ребенок будет в восторге, когда почувствует, что его понимают и с ним общаются.</p>

<p><strong>Чему при этом учится ребенок: </strong>Ваш ребенок развивает речевые и коммуникативные навыки. Он также более уверенно чувствует себя в социальных ситуациях. С вашей поддержкой он будет чувствовать себя еще более спокойно и комфортно в новых ситуациях.</p>",12566,no,parent,,6441,2876,1,ru,published
7351,Рисую на бумаге!,"<p><strong>Необходимые материалы: </strong>Мелок, карандаш или фломастеры (по возможности несколько); большие листы бумаги (может быть даже газета или обратная сторона каких-нибудь печатных материалов). </p>

<p><strong>В чем заключается занятие: </strong>В этом возрасте большинство детей еще не умеют рисовать что-нибудь «реалистичное», но очень любят калякать по бумаге чем угодно. Возможно, он начал пробовать делать что-то на бумаге несколько месяцев назад; сейчас самое время еще больше поощрять его творчество. Не ограничивайте ребенка по времени, просто дайте ему большой лист бумаги на ровной твердой поверхности, и то, чем можно рисовать или писать. Малыш сам потянется за мелком и ли карандашом и начнет возить им по бумаге.</p>

<p>Пусть делает что и как захочет, и сколько угодно по времени. Можете рассказывать, что у него получилось: «О, смотри, как ты раскрасил это лист мелками. Тут вот большой круг, а вон там длинная-длинная линия!». Можете повесить результат творчества на стену, чтобы другие члены семьи тоже видели, чем сегодня занимался малыш.</p>

<p><strong>Чему при этом учится ребенок: </strong>Этот опыт — первые шаги к рисованию и письму. Ваш ребенок начинает лучше контролировать мелкие мышцы пальцев и рук.  Еще он начинает осознавать связь между тем, о чем думает (провести длинную-длинную линию), и тем, что делают его пальцы. Кроме того, проговаривая, что делает и ребенок и что вы видите. вы стимулируете ее языковое развитие. </p>",12571,yes,parent,,6441,2821,1,ru,published
7356,Давай все соберем!,"<p><strong>Необходимые материалы: </strong>Любые мелкие предметы, которые вашему ребенку будет интересно собирать с пола, и контейнер, в который их можно бросать.</p>

<p><strong>В чем заключается занятие: </strong>По мере того, как ваш ребенок становится старше, он будет начинать использовать для всех дел одну руку больше, чем другую. Не нужно отдельно учить ребенка пользоваться чаще правой или левой рукой. Лучше предлагайте самые разнообразные возможности делать что-то руками. Одна из таких игра — разбросать по полу разные небольшие предметы (главное — безопасно) и затем собирать их в корзину или небольшой ящик. Будьте рядом, следите за безопасностью (дети любят тащит в рот мелкие предметы), подсказывайте ребенку собирать предметы в контейнер и вынимать их. Можете тоже участвовать, говорите «И еще один кубик в корзину. И следующий. Теперь твоя очередь!». </p>

<p>Будет любопытно понаблюдать, делает ли ребенок все обеими руками в равной степени, или он чаще делает что-то правой или левой рукой. Можете понаблюдать за ним и на улице, когда он собирает прутики или листья, или дома, когда он пользуется чашкой или ложкой.</p>

<p><strong>Чему при этом учится ваш ребенок: </strong>Взаимодействие с различными предметами — это часть развития «мелкой моторики» — навыков, которые позже будут нужны, например, для того, чтобы держать ручку при письме. Каждый день делать что-то новое — это весело и важно. Это упражнение также может способствовать развитию речи и языковых навыков, если вы не забываете проговаривать названия предметов.</p>",12576,yes,parent,,6421,2816,1,ru,published
7361,Вместе вверх и вместе вниз,"<p><strong>Необходимые материалы: </strong>Не потребуются.</p>

<p><strong>В чем заключается занятие: </strong>В этом возрасте ваш ребенок может начинать пытаться подниматься по лестницам (у вас дома или в другом месте, где есть лестницы). Вы можете сочинить небольшую песенку или рифмовку для подъема и спуска по ступенькам. Например: «По сту-пень-кам под-ни-мись и по-том на-зад спусь-тись!». На последнюю ступеньку можно положить игрушку или другой небольшой предмет, чтобы малышу было интереснее добраться до верха. Важно при этом быть рядом с ребенком — положите руку на спину ребенка, встаньте на следующую или предыдущую ступеньку, поддерживайте ребенка сзади — в общем, всегда будьте рядом, чтобы все было безопасно.</p>

<p><strong>Что изучает ваш ребенок: </strong>При этом занятии улучшается физическая координация. А еще у малыша повышается уверенности в том, что вы всегда ему поможете научиться новому и ему при этом всегда будет спокойно и безопасно.</p>

<p> </p>",12581,no,parent,,6431,2796,1,ru,published
7366,Обыгрывать прощание,"<p><strong>Необходимые материалы: </strong>История, которую вы будете рассказывать — из сборника рассказов или придуманная вами; также куклы, мягкие игрушки или другие предметы, чтобы разыграть историю.</p>

<p><strong>В чем заключается занятие: </strong>В этом возрасте ваш ребенок может менее выражено проявлять свое недовольство, чем когда он был поменьше, когда вы уходите и его оставляете его с кем-то или где-то на какое-то время (например, с бабушкой, дедушкой или няней, или в садике). Есть несколько способов сделать так, что ребенок чувствовал себя спокойнее, один из них — рассказать историю или разыграть сценку. Например, можете прочитать или придумать рассказ о маленькой девочке или мальчике, чья мама уходит в магазин. Присматривать за ребенком остается соседка. В вашем рассказе вы можете проговорить, что малыш расстроен, но, при этом он машет маме рукой на прощание, сидя на коленях соседки, потом играет какое-то время во что-то и с радостью встречает маму, когда она возвращается. </p>

<p>Что-то подобное можно также можно разыграть с куклами или другими игрушками. Можете попросить ребенка порассуждать: «Как можно сделать так, чтобы маленькой девочке стало веселее?  Кто-нибудь может ей помочь?». </p>

<p>Конечно, вы можете помочь своему ребенку более спокойно относиться к временной разлуке, когда вам нужно отлучиться по делам. Когда вы уходите на время, обязательно сообщите своему ребенку, когда вы вернетесь, расскажите ему, кто и как будет за нем присматривать в ваше отсутствие, и предложите ему несколько вариантов того, чем можно занять себя, пока вас не будет.</p>

<p><strong>Чему при этом учится ребенок: </strong>Все эти упражнения помогут вашему ребенку почувствовать себя спокойнее и научиться управлять своими эмоциями. Ваш ребенок учится справляться с тревожными ситуациями. Он также при этом учится думать о будущем и планировать.  </p>",12586,yes,parent,,6436,2781,1,ru,published
7371,Вместе с друзьями,"<p><strong>Необходимые материалы: </strong>Простые игрушки или предметы для игры на улице. Безопасное, подходящее место для совместной игры небольшого количества детей.</p>

<p><strong>В чем заключается занятие: </strong>В этом возрасте ваш ребенок начинает играть вместе с другими детьми своего возраста — не просто играть сам по себе рядом с ними, но и начинает что-то делать вместе с ними. Если есть такая возможность, давайте ребенку играть с небольшими группами, сначала непродолжительное время (если у вашего ребенка не было достаточно возможностей привыкнуть играть вместе с детьми, например, в садике). Парки или игровые площадки являются хорошим местом для того, чтобы найти вашему ребенку компанию для игр. Понаблюдайте, интересно ли ребенку играть с другими детьми. Если вам кажется, что они не знают, что делать, подскажите и предложите: «Смотри, вот вам два совочка, по одному для каждого. Сможете вместе выкопать яму? Попробуйте сделать большую-большую!» Важно следить за безопасностью и помогать детям в случае конфликтов. Помните, что они пока не все могут выразить словами и социальные навыки у них только формируются.</p>

<p><strong>Чему при этом учится ребенок: </strong>Ребенку начинает нравиться социальное взаимодействие с разными людьми. Для того, чтобы ребенку было комфортно в школе и в разных жизненных ситуациях, ему важно выработать навыки взаимодействия с людьми. Для игр с другим детьми ребенку также понадобятся навыки мышления и планирования, он выработает способность контролировать свои эмоции.</p>",12591,yes,parent,,6436,2766,1,ru,published
