ID,Title,Body,Cover_image,Equipment,Type_of_support,Child_age,Domain,Related_milestones,Mandatory_content,Translation_language,Moderation_state
7586,"На разные голоса","<p><strong>Что вам понадобится: </strong>Ничего</p>

<p><strong>В чем заключается занятие: </strong>С самого первого дня своей жизни ваш ребенок общается с вами, а вы с ним. Есть множество разных упражнений и стратегий, которые вы можете использовать, чтобы стимулировать развитие у ребенка речевых и языковых навыков.</p>

<p>Для начала, положите ребенка на мягкую поверхность или держите его на руках, лицом к себе. Для начала спойте ему песенку высоким или детским голосом. Большинству малышей нравится такой голос — вы заметите, что его сердце стало биться чаще, он возбужден и активен.</p>

<p>Затем спойте ту же песню, но на этот раз более низким или более тихим голосом. Вы увидите, что реакция ребенка будет более спокойной — он будет доволен и безмятежен.</p>

<p>Петь или рассказывать ребенку что-то на разные голоса — это отличный способ помочь ребенку начать распознавать другие голоса и, как следствие, научиться выражать эмоции, которые они у него вызывают; это также полезно для вас — вы видите и учитесь понимать реакцию вашего ребенка.</p>

<p><strong>Чему при этом учится ребенок: </strong>Помимо стимулирования распознавания разных тембров и голосов, это упражнение помогает вашему ребенку отличать человеческие голоса от других звуков, что способствует развитию его языковых и коммуникативных навыков.</p>",12726,no,parent,,39,2531,1,by-ru,draft
7591,"Смотрим с любовью","<p><strong>Что вам понадобится: </strong>Ничего или мягкое кресло.  </p>

<p><strong>В чем заключается занятие: </strong>Наблюдать за реакцией малыша всегда весело и полезно. Для начала вам нужно выбрать место, где вы будете играть. Важно, чтобы вокруг не было предметов или звуков, отвлекающих внимание вашего ребенка.</p>

<p>Положите ребенка на спину, на мягкую поверхность или в детское кресло. Смотрите на него, не отвлекаясь, чтобы он тоже обратил на вас внимание. Ну что, поиграем? Измените выражение лица, расплываясь в широкой улыбке и издайте какой-нибудь звук. Следите за реакцией ребенка — скорее всего, он улыбнется вам в ответ. Никогда не будет лишним нежно поцеловать ребенка в лоб или щеку, это пусть малыш знает, что это момент любви и нежности.</p>

<p>Попробуйте разные выражения лица и жесты, но следите за тем, что бы ни в коем случае не напугать  или вызывать дискомфорт.</p>

<p><strong>Чему при этом учится ребенок: </strong>Это веселое занятие поможет вам лучше общаться с малышом, поскольку оно стимулирует активности тех нейронов, которые создают связи в мозгу, отвечающие за  языковое развитие. Взаимодействие в обстановке спокойствия и любви также способствует развитию более сильной эмоциональной привязанности и навыков социального взаимодействия.</p>",12466,no,parent,,37,2536,1,by-ru,draft
7596,"Имитируем детскую речь","<p><strong>Что понадобится: </strong>Ничего или детский стульчик</p>

<p><strong>В чем заключается занятие: </strong>Различные окружающие ребенка звуки стимулируют у него развитие речи. Следующее упражнение поможет вам научиться лучше общаться с малышом.</p>

<p>Подержите ребенка некоторое время на руках, затем уложите его на спину на мягкую поверхность или усадите ребенка в его стульчик кресло. Начните просто рассказывать что-нибудь малышу и следите за его реакцией.</p>

<p>Ребенок начнет отвечать вам, издавая нежные тихие звуки, повторяйте их, сначала тихо, а затем более интенсивно, что и ребенок в ответ начал реагировать более громко.</p>

<p>Не забывайте всё делать позитивно и спокойно. В конце занятия поцелуйте или обнимите ребенка.</p>

<p><strong>Чему при этом учится ребенок: </strong>Такие упражнения стимулируют слух и распознавать различных основных фонем, что ускоряет процесс развития речи. Это также позволяет ребенку слышать со стороны звуки, которые он издает.</p>",12731,no,parent,,39,2541,1,by-ru,draft
7606,"Следи за мячом","<p><strong>Что вам понадобится: </strong>Мяч, одеяло</p>

<p><strong>В чем заключается занятие: </strong>Для этого прекрасного занятия вам нужно будет заранее продумать, где вы собираетесь выполнить это упражнение. Выберите комнату, где ничто не будет отвлекать внимание малыша, постелите одеяло на пол или большую кровать. Затем положите малыша на живот так, чтобы он лежал на одеяле. Сядьте перед ним, на некотором расстоянии, расставив ноги так, чтобы они были по обе стороны от ребенка.</p>

<p>Заговорите со своим малышом, чтобы привлечь его внимание, и когда он посмотрит на вас, возьмите мяч, покажите ему и положите на пол. Медленно перекатывайте мяч из стороны в сторону, чтобы малыш следил за мячом глазами. Продолжайте минут пять или пока не заметите, что ваш малыш устал. Если он пока не умеет поднимать голову, показывайте ему мяч, приподнимая него с пола и перемещая его только вверх-вниз. Через некоторое время его мышцы достаточно окрепнут, чтобы поднимать голову, а пока пусть следит за мячом глазами.</p>

<p><strong>Чему при этом учится ребенок: </strong>Это укрепляет мышцы вашего малыша, одновременно стимулирует его зрение, развивает способность следить за движущимися объектами взглядом, что является обязательным навыком для зрительно-моторной координации, необходимой для чтения и письма в будущем.</p>",12736,yes,parent,,35,2556,1,by-ru,draft
7766,"Я кормлю себя ТЕСТ","<p><strong>Необходимые материалы: </strong>Маленькие кусочки еды, которые нравятся вашему ребенку; удобное место, чтобы ваш ребенок мог сидеть с едой перед собой.</p>

<p><strong>Что вы можете делать вместе: </strong>Это тот возраст, когда многие дети действительно начинают кушать самостоятельно. Ваш ребенок, вероятно, еще не пользуется ложкой, но может кушать руками! Если вы еще не начали, положите кусочки вкусной еды так, чтобы ребенок мог их достать. Он / она может сразу взять один из них положить в рот.  Если  это произойдет, то покажите свой восторг («Ты сам это съел!» или «А фрукт вкусный?»). Вы также можете откусить кусок самостоятельно, чтобы показать, насколько вам  нравится еда. Или положите кусочек пищи в рот ребенку и посмотрите, сделает ли он то же самое.</p>

<p><strong>Что изучает ваш ребенок: </strong>В зависимости от ваших культурных традиций и развития вашего ребенка, вы можете время от времени продолжать кормить ребенка. Однако, поощрение самостоятельного кормления укрепляет скоординированность действий и точность движений руками. Это навыки, которые спустя годы помогут ему / ей начать рисовать и писать. Когда вы разговариваете с ребенком во время еды, вы также поощряете его / ее речевое развитие (например, название продуктов).</p>",12776,yes,parent,,39,2936,1,by-ru,draft