ID,Title,Body,Cover_image,Equipment,Type_of_support,Child_age,Domain,Related_milestones,Mandatory_content,Translation_language,Moderation_state
7536,"Животные из отпечатков пальцев","<p><strong>Что понадобится: </strong>Пальчиковые моющиеся краски/нетоксичные краски; Неглубокая посуда для смешивания краски; Бумага; Фартуки или старая одежда; Скатерть; Тряпка.</p>

<p><strong>В чем заключается занятие: </strong>Сперва подготовьте все, что вам понадобится как для творчества, так и для уборки (особенно с детьми младшего возраста).</p>

<p>Спросите у детей, каких животных они хотели бы создать. Это может быть кто угодно — кошка, слон, мышь, черепаха… или даже несколько животных, чтобы получилась ферма, зоопарк или джунгли!</p>

<p>Достаем краски! Можно использовать неглубокую посуду, чтобы смешивать — это отличный способ показать детям, как получать новые цвета.</p>

<p>Попросите детей окунуть палец в краску, а затем оставить отпечаток на бумаге, который будет служить головой и туловищем животных.</p>

<p>Пусть краска высохнет, после чего дети могут дорисовать более мелкие детали — уши, полоски, хвосты — все, что нужно, чтобы получился задуманный ими зверь!</p>

<p>Детям постарше, возможно, захочется порисовать пальцами еще, создавая из отпечатков фон, например, море из отпечатков вокруг черепахи или траву и деревья вокруг слона.</p>

<p>Детям младшего возраста может хотеться просто наляпать как можно больше краски и размазать ее пальцами по листу. Запаситесь достаточным количество бумаги, чтобы они творили сколько душе угодно!</p>

<p><strong>Чему при этом учится ребенок</strong>: Малышам никогда не наскучивает рисовать! Это творческое задание позволяет детям использовать цвета и формы для самовыражения, и в итоге у них получаются любимые животные!</p>",11891,yes,parent,,38,7091,1,by-ru,draft
7541,"Семейное интервью","<p><strong>Необходимые материалы: </strong>Не потребуются</p>

<p><strong>Что вы можете делать вместе: </strong>Решите, кто первым сядет на место для интервью и поощряйте своих детей задавать им вопросы! Нужно вдохновение? Попробуйте начать с вопросов, приведенных ниже и посмотрите, к чему вас приведет разговор!</p>

<p>1. Ухаживали ли вы за домашними животными?</p>

<p>2. Вы предпочитаете зиму или лето? Почему?</p>

<p>3. Какая твоя любимая еда?</p>

<p>4. Вы когда-нибудь жили в другой стране? Вы хотели бы? Где?</p>

<p>5. Какая ваша любимая песня?</p>

<p>6. Вы когда-нибудь ломали кость?</p>

<p>7. Какой последний фильм вы смотрели?</p>

<p>8. Если бы вы могли вернуться в прошлое и встретить кого-нибудь из истории, кто бы это был?</p>

<p>Теперь поощряйте детей думать над своими собственными вопросами - им не обязательно быть разумными! Как насчет того, чтобы спросить, на какое животное они больше всего похожи или какую пищу они будут есть каждый день до конца своей жизни? Удачи!</p>

<p>Сделайте это занятие более увлекательным, побудив ваших детей притвориться репортером с красной ковровой дорожки!</p>

<p><strong>Что изучает ваш ребенок: </strong>Любознательные дети будут вести себя естественно на этом занятии, здесь они могут поставить свою семью (это вы!) на место для интервью! Это верный способ развить их социальные и коммуникативные навыки и в процессе узнать что-то новое о вас.</p>",12121,no,parent,,39,7096,1,by-ru,draft
7546,"Игра &quot;Угадай животное&quot;","<p><strong>Что понадобится: </strong>Ничего</p>

<p><strong>В чем заключается занятие:</strong> Кто-то начинает игру и говорит: «Я загадал животное, которое начинается с буквы…». Затем другие игроки по очереди задают вопросы, чтобы попытаться угадать животное. Они могут задавать любые вопросы, но ответ может быть только «да» или «нет». Например, у него четыре лапы? У него есть хвост? Это млекопитающее? Оно может летать? Как только кто-то угадывать животное, игроки меняются ролями. Хотите усложнить задачу? Не говорите, с какой буквы оно начинается!</p>

<p>Чтобы было ещё сложнее, можно загадывать и доисторических животных!</p>

<p><strong>Чему при этом учится ребенок: </strong>Детям, которым очень интересно все про животных, понравится демонстрировать свои знания и отгадывать. При этом нужно будет ещё и проявлять смекалку — выяснить, что же за загадочное животное загадано. Это развивает навыки критического мышления и расширяет кругозор!</p>",12241,no,parent,,39,7101,1,by-ru,draft
7551,"Книга &quot;Обо мне&quot;","<p><strong>Что понадобится: </strong>Бумага (обычная или цветная), карандаш или восковые мелки или маркеры, скотч или степлер; Первая страница книги с уже написанным словами «Книга обо мне». Карточки или листы бумаги с именем и фамилией, возрастом и домашним адресом вашего ребенка, написанные большими буквами (чтобы он могла попытаться перерисовать). Все что угодно, что пригодится для декорирования «Книги обо мне». Например, наклейки, фотографии вашего ребенка и т.д.</p>

<p><strong>В чем заключается занятие: </strong>Предложите своему ребенку сделать о нем отдельную книгу! Сделайте первую страницу «Меня зовут» — помогите ребенку переписать или перерисовать свое имя и фамилию на эту страницу. Ваш ребенок может нарисовать на этой странице свое лицо или приклеить готовую фотографию. Следующей страницей может быть «Мой адрес». Помогите ребенку переписать адрес на эту страницу, или напишите сами, а ребенок пусть нарисует место, где он живет. </p>

<p>Ориентируйтесь на то, чего хочется и что интересно ребенку — можете добавить страницы «Мое домашнее животное» (если есть), «Моя любимая еда», «Мой брат» и т.д. Делайте все вместе, чтобы ребенку хотелось пробовать писать или перерисовывать слова, делать собственные иллюстрации.</p>

<p>В конце скрепите все страницы скотчем или степлером. Прочитайте эту книжку другим членам семьи! Не убирайте ее далеко, пусть ребенок знает, где она, чтобы он сам мог ее брать и читать снова и снова.</p>

<p><strong>Чему при этом учится ребенок: </strong>Ребенку важно знать свое полное имя и адрес — это вопрос безопасности на случай, если они потеряются. Эти знания и сведения также формируют у него ощущение индивидуальности и понимание своего места в семье и обществе. Это занятие также важно для стимулирования изучения или повторения букв и слов, понимания важности чтения и письма в повседневной жизни.</p>",12706,yes,parent,,38,7111,1,by-ru,draft
7556,"Поездка в автобусе","<p><strong>Что понадобится: </strong>Стулья; Реквизит (по <em>желанию</em>); Деньги или жетоны (по желанию)</p>

<p><strong>В чем заключается занятие: </strong>Расставьте стулья так, чтобы было похоже на салон автобуса — один стул впереди для водителя и несколько сзади для пассажиров. Чем больше стульев и игроков, тем веселее!</p>

<p>Назначьте одного игрока водителем, пусть займет свое место и приступает. Подбадривайте детей, что они играли максимально активно: имитировали повороты дороги, остановки на светофоре, звуковые сигналы и т.д.</p>

<p>Остальные игроки стоят рядом, будто на автобусной остановке, ожидая своего автобуса. Время от времени водитель «делает остановки» и объявляет их — например, парк, центр города, зоопарк, библиотека или школа. Пассажиры заходят в автобус, занимают места и отправляются в путь!</p>

<p>Можно заранее продумать маршрут автобуса до начала игры — пассажиры могут продумывать, откуда и куда они хотят добраться, что делать по приезду, как добираться назад. Можно также попросить пассажиров оплатить проезд или использоваться имеющиеся билеты — это отличный способ попрактиковаться в счете и арифметике.</p>

<p>Основная цель состоит в том, всем было весело: это игра на воображение и импровизацию!</p>

<p><strong>Чему при этом учится ребенок: </strong>Эта увлекательная групповая (или семейная) игра требует от детей воображения и импровизации — они совершают воображаемое путешествие на автобусе! Ее также можно использовать для того, чтобы весело попрактиковаться в арифметике и счете.</p>",12721,yes,parent,,39,,0,by-ru,draft
7561,Кегли,"<p><strong>Что вам понадобится: </strong>Кегли, мяч.</p>

<p><strong>В чем заключается занятие: </strong>Это игра на открытом воздухе. Пусть дети расставят кегли (или пустые пластиковые бутылки) в форме треугольника или ромба с достаточным интервалом друг от друга. Игроки бросают мяч с четырех-пяти метров так, чтобы он катился и сбивал кегли. Задача — сбить как можно больше за один бросок. За каждую сбитую кеглю начисляется очко. Побеждает тот, кто наберет наибольшее количество очков после десяти раундов! Можно усложнять правила, увеличивая расстояние до кеглей в каждом последующем раунде.</p>

<p><strong>Чему при этом учится ребенок: </strong>Кегли - это простая игра, в которую играли еще в древнем Египте! Это отличное развлечение, оно способствует развитию когнитивных и двигательных навыков детей. Это отличная игра для всей семьи.</p>",11826,yes,parent,,38,7121,1,by-ru,draft
7566,"Сбор мусора","<p><strong>Что потребуется: </strong>Перчатки; Пакет для мусора; Палка-хваталка (<em>по</em> <em>желанию</em>).</p>

<p><strong>В чем заключается занятие: </strong>Отправляйтесь со своим ребенком куда-то, где есть мусор — на территорию школы, на игровую площадку, в парк или на берег водоема. Убедитесь, что это безопасно, просто наденьте перчатки и начинайте собирать мусор! Можете дать ребенку задание замечать птиц, насекомых и прочую живность — у всех них будет более чистая среда обитания благодаря вашим усилиям.</p>

<p>Попробуйте соорудить что-нибудь из тех предметов, которые вы дома выбрасываете — пакетов, банок, макулатуры.</p>

<p><strong>Чему при этом учится ребенок: </strong>Вы наверняка замечаете мусор вокруг, когда гуляете. Сбор мусора - отличная возможность узнать много нового, так что отправляйтесь на подвиги с вашим ребенком и покажите ему, как вы можете помочь природе и сделать окружающую среду чище. Такое внимание к окружающей среде еще и способствует понимание того, что каждый из нас в силах сделать что-то полезное!</p>",12211,yes,parent,,38,7126,1,by-ru,draft
7571,"Полет фантазии","<p><strong>Что понадобится: </strong>Ничего</p>

<p><strong>В чем заключается занятие: </strong>Поговорите с детьми о том, каково бы это было уметь летать. Куда они полетели? Что бы увидели? С какой скоростью бы летали?</p>

<p>Может быть, они попытаются представить, каково будет побывать на Луне, или, возможно, эту свех-способность они бы использовали, чтобы спасать животных.</p>

<p>Обсуждайте всё подробно — пусть ребенок представит, какой воздух на высоте 5 000 метров, чем пахнет? Какие при этом ощущения? Нет неправильных ответов, это же полет фантазии!</p>

<p>Знаете ли вы, что самая быстрая птица в мире — сапсан? Эти феноменальные птицы могут развивать скорость до 380 километров в час!</p>

<p><strong>Чему при этом учится ребенок:  </strong>Дети с богатым воображением с удовольствием фантазируют о том, каково было бы уметь летать! Это занятие способствует общению, дети учатся озвучивать свои мысли, чувства и фантазии.</p>",11906,no,parent,,39,7131,1,by-ru,draft
7576,"Гонка на тачках","<p><strong>Вам понадобится: </strong>Ничего</p>

<p><strong>В чем заключается занятие: </strong>Найдите ровную, травяную площадку и решите, где будут старт и финиш. Это соревнования на скорость. Разделите участников на пары. В каждой паре один ребенок будет «тачкой», он ложится на траву, за ним встает его напарник. Перед началом забега второй участник поднимает «тачку» за лодыжки, а «тачка» приподнимается на рукам. Итак… на старт, внимание, марш! Каждая пара пытается прийти в финишу первой — «тачка катится» на руках, напарник следует за ней, держа за ноги. Неизвестно что сложнее — прийти первыми к финишу или не упасть от смеха по пути?!</p>

<p>Пусть темп задает «тачка», а не напарник!</p>

<p><strong>Чему при этом учится ребенок: </strong>Это классическая игра, в которой от детей требуется работа в парах, чтобы дойти до финиша. Это развивает их социальные навыки, к тому же это весело! При этом дети тренируют равновесие, координацию, силу и навыки работы в команде!</p>",12191,no,independent,,37,7136,1,by-ru,draft
7581,Равновесие,"<p><strong>Что понадобится: </strong>Удобный стул или кресло</p>

<p><strong>В чем заключается занятие:</strong> Вашему ребенку нет еще и месяца от роду и он почти не понимает, что происходит вокруг. Его мир пока совсем крошечный, ему еще только предстоит его открыть. Это упражнение призвано стимулировать развитие зрения и изучение всего вокруг.</p>

<p>Для начала следует взять малыша на руки и сесть в удобное кресло. Держите ребенка так, чтобы он был развернут головой в сторону ваших ног. Поддерживайте спину и головку обеими руками; так ребенок будет чувствовать себя в безопасности.</p>

<p>Теперь нужно привлечь внимание ребенка, чтобы он задержал взгляд на вашем лице. Для этого можно просто назвать его по имени,  спеть приятную песню, прочитать стишок или просто сказать ребенку что-то приятное и ласковое.</p>

<p>Убедившись, что внимание ребенка обращено на вас, медленно покачивайте ребенка из стороны в сторону. Всегда старайтесь говорить или петь при этом; можно попробовать немного менять положение или движения, чтобы разнообразить упражнение.</p>

<p>Если вы заметили, что ребенок перестал смотреть на вас, сделайте паузу и снова привлеките его внимание. Прекратите упражнение, когда поймете, что ребенок устал. Никогда не пытайтесь принуждать ребенка участвовать в этой занятии — из игры это превратиться в некомфортную ситуацию и цель не будет достигнута.</p>

<p><strong>Чему при этом учится ребенок: </strong>Это упражнение поможет вашему ребенку координировать движение глаз и сосредоточить взгляд на конкретном предмете, а также поможет ему научиться узнавать ваше лицо или лица близких людей, развивает навыки социального взаимодействия и стимулировать выработку понимания состояния равновесия.</p>",12341,no,parent,,54,2526,1,by-ru,draft
