ID,Title,Body,Cover_image,Equipment,Type_of_support,Child_age,Domain,Related_milestones,Mandatory_content,Translation_language,Moderation_state
7356,"Давай все соберем!","<p><strong>Что понадобится: </strong>Любые мелкие предметы, которые вашему ребенку будет интересно собирать с пола, и контейнер, в который их можно бросать.</p>

<p><strong>В чем заключается занятие: </strong>По мере того, как ваш ребенок становится старше, он будет начинать использовать для всех дел одну руку больше, чем другую. Не нужно отдельно учить ребенка пользоваться чаще правой или левой рукой. Лучше предлагайте самые разнообразные возможности делать что-то руками. Одна из таких игра — разбросать по полу разные небольшие предметы (главное — безопасно) и затем собирать их в корзину или небольшой ящик. Будьте рядом, следите за безопасностью (дети любят тащит в рот мелкие предметы), подсказывайте ребенку собирать предметы в контейнер и вынимать их. Можете тоже участвовать, говорите «И еще один кубик в корзину. И следующий. Теперь твоя очередь!». </p>

<p>Будет любопытно понаблюдать, делает ли ребенок все обеими руками в равной степени, или он чаще делает что-то правой или левой рукой. Можете понаблюдать за ним и на улице, когда он собирает прутики или листья, или дома, когда он пользуется чашкой или ложкой.</p>

<p><strong>Чему при этом учится ваш ребенок: </strong>Взаимодействие с различными предметами — это часть развития «мелкой моторики» — навыков, которые позже будут нужны, например, для того, чтобы держать ручку при письме. Каждый день делать что-то новое — это весело и важно. Это упражнение также может способствовать развитию речи и языковых навыков, если вы не забываете проговаривать названия предметов.</p>",12576,yes,parent,,35,2816,1,by-ru,draft
7361,"Вместе вверх и вместе вниз","<p><strong>Что понадобится: </strong>Ничего</p>

<p><strong>В чем заключается занятие: </strong>В этом возрасте ваш ребенок может начинать пытаться подниматься по лестницам (у вас дома или в другом месте, где есть лестницы). Вы можете сочинить небольшую песенку или рифмовку для подъема и спуска по ступенькам. Например: «По сту-пень-кам под-ни-мись и по-том на-зад спусь-тись!». На последнюю ступеньку можно положить игрушку или другой небольшой предмет, чтобы малышу было интереснее добраться до верха. Важно при этом быть рядом с ребенком — положите руку на спину ребенка, встаньте на следующую или предыдущую ступеньку, поддерживайте ребенка сзади — в общем, всегда будьте рядом, чтобы все было безопасно.</p>

<p><strong>Что изучает ваш ребенок: </strong>При этом занятии улучшается физическая координация. А еще у малыша повышается уверенности в том, что вы всегда ему поможете научиться новому и ему при этом всегда будет спокойно и безопасно.</p>

<p> </p>",12581,no,parent,,37,2796,1,by-ru,draft
7366,"Обыгрывать прощание","<p><strong>Что понадобится: </strong>История, которую вы будете рассказывать — из сборника рассказов или придуманная вами; также куклы, мягкие игрушки или другие предметы, чтобы разыграть историю.</p>

<p><strong>В чем заключается занятие: </strong>В этом возрасте ваш ребенок может менее выражено проявлять свое недовольство, чем когда он был поменьше, когда вы уходите и его оставляете его с кем-то или где-то на какое-то время (например, с бабушкой, дедушкой или няней, или в садике). Есть несколько способов сделать так, что ребенок чувствовал себя спокойнее, один из них — рассказать историю или разыграть сценку. Например, можете прочитать или придумать рассказ о маленькой девочке или мальчике, чья мама уходит в магазин. Присматривать за ребенком остается соседка. В вашем рассказе вы можете проговорить, что малыш расстроен, но, при этом он машет маме рукой на прощание, сидя на коленях соседки, потом играет какое-то время во что-то и с радостью встречает маму, когда она возвращается. </p>

<p>Что-то подобное можно также можно разыграть с куклами или другими игрушками. Можете попросить ребенка порассуждать: «Как можно сделать так, чтобы маленькой девочке стало веселее?  Кто-нибудь может ей помочь?». </p>

<p>Конечно, вы можете помочь своему ребенку более спокойно относиться к временной разлуке, когда вам нужно отлучиться по делам. Когда вы уходите на время, обязательно сообщите своему ребенку, когда вы вернетесь, расскажите ему, кто и как будет за нем присматривать в ваше отсутствие, и предложите ему несколько вариантов того, чем можно занять себя, пока вас не будет.</p>

<p><strong>Чему при этом учится ребенок: </strong>Все эти упражнения помогут вашему ребенку почувствовать себя спокойнее и научиться управлять своими эмоциями. Ваш ребенок учится справляться с тревожными ситуациями. Он также при этом учится думать о будущем и планировать.  </p>",12586,yes,parent,,38,2781,1,by-ru,draft
7371,"Вместе с друзьями","<p><strong>Что понадобится: </strong>Простые игрушки или предметы для игры на улице. Безопасное, подходящее место для совместной игры небольшого количества детей.</p>

<p><strong>В чем заключается занятие: </strong>В этом возрасте ваш ребенок начинает играть вместе с другими детьми своего возраста — не просто играть сам по себе рядом с ними, но и начинает что-то делать вместе с ними. Если есть такая возможность, давайте ребенку играть с небольшими группами, сначала непродолжительное время (если у вашего ребенка не было достаточно возможностей привыкнуть играть вместе с детьми, например, в садике). Парки или игровые площадки являются хорошим местом для того, чтобы найти вашему ребенку компанию для игр. Понаблюдайте, интересно ли ребенку играть с другими детьми. Если вам кажется, что они не знают, что делать, подскажите и предложите: «Смотри, вот вам два совочка, по одному для каждого. Сможете вместе выкопать яму? Попробуйте сделать большую-большую!» Важно следить за безопасностью и помогать детям в случае конфликтов. Помните, что они пока не все могут выразить словами и социальные навыки у них только формируются.</p>

<p><strong>Чему при этом учится ребенок: </strong>Ребенку начинает нравиться социальное взаимодействие с разными людьми. Для того, чтобы ребенку было комфортно в школе и в разных жизненных ситуациях, ему важно выработать навыки взаимодействия с людьми. Для игр с другим детьми ребенку также понадобятся навыки мышления и планирования, он выработает способность контролировать свои эмоции.</p>",12591,yes,parent,,38,2766,1,by-ru,draft
7516,"Играем в магазин","<p><strong>Что вам понадобится: </strong>Различные бытовые предметы, чтобы их «продавать» в магазине; Монеты, жетоны или фишки; Стикеры; Ручка или карандаш; Калькулятор (необязательно)</p>

<p><strong>В чем заключается занятие: </strong>Соберите для магазина разные предметы - это может быть что угодно: от игрушек, книг и дисков до одежды, консервов и фруктов. Пусть дети сделают ценники на стикерах. Интересно, какую цену они назначат за каждую вещь? Вместо денег можно использовать фишки, жетоны или даже стеклянные бусины (нужно просто что-то, что дети смогут обменять на «товары»).</p>

<p>Затем решите, кто будет играть роль продавца, а кто будет покупателем. Если вы играете с настоящими деньгами, распределите монеты так, чтобы покупатели могли выбирать себе покупки, а продавец мог давать сдачу.</p>

<p>Пусть покупатели решают, сколько чего они в состоянии купить и сколько денег они готовы потратить. Продавец подсчитывает итоговую сумму (в уме, на бумаге или с помощью калькулятора), берет деньги и отсчитывает сдачу.</p>

<p>Пусть дети меняются ролями. Пусть выбирают разные товары для покупки и продажи и практикуются складывать и вычитать числа!</p>

<p><strong>Чему при этом учится ребенок: </strong>Ролевые игры - это прекрасный способ стимулировать развитие у малышей воображения, социальных навыков и уверенности в себе. Кроме того, игра в магазин дает детям возможность закрепить арифметические знания и потренироваться обращаться с деньгами.</p>",12696,yes,parent,,39,7071,1,by-ru,draft
7521,"Домашний оркестр","<p><strong>Что понадобится: </strong>Кастрюли; Формы для выпечки; Пластиковые горшки; Металлические ложки; Деревянные ложки; Венчик; Бутылки; Вода; Резинки; Обувная коробка</p>

<p><strong>В чем заключается занятие: </strong></p>

<p>Шаг 1</p>

<div alt=""Illustration of Household orchestra Step 1"" data-embed-button=""media_browser"" data-entity-embed-display=""media_image"" data-entity-type=""media"" data-entity-uuid=""f7912d33-996c-47d7-9eb8-ec182a4a0970"" data-langcode=""en"" title=""household-orchestra-step-1.png"" class=""embedded-entity"">  <img src=""/docroot/sites/default/files/2021-05/household-orchestra-step-1.png"" alt=""Illustration of Household orchestra Step 1"" title=""household-orchestra-step-1.png"" typeof=""foaf:Image"" /></div>
<p>Взгляните на все эти предметы и предложите детям «поиграть» на них. Металлические кастрюли и сковороды будут основой ударной секции. Пусть попробуют — как будет звучать каждый «инструмент», если по нему стучать деревянным или металлическим предметом?</p>

<p>Шаг 2</p>

<div alt=""Illustration of Household orchestra Step 2"" data-embed-button=""media_browser"" data-entity-embed-display=""media_image"" data-entity-type=""media"" data-entity-uuid=""6f38118f-8d1d-4410-9eac-e031b424b136"" data-langcode=""en"" title=""household-orchestra-step-2.png"" class=""embedded-entity"">  <img src=""/docroot/sites/default/files/2021-05/household-orchestra-step-2.png"" alt=""Illustration of Household orchestra Step 2"" title=""household-orchestra-step-2.png"" typeof=""foaf:Image"" /></div>
<p>Наполните стеклянные бутылки разного размера разным количеством воды. Резко подуйте в горлышко бутылки, и вы услышите «свист». Можно использовать и пластиковые бутылки из-под молока или соусов, но стекло лучше. Теперь у вас есть духовые. А еще по ним можно постукивать ложкой — получится ксилофон.</p>

<p>Шаг 3</p>

<div alt=""Illustration of Household orchestra Step 3"" data-embed-button=""media_browser"" data-entity-embed-display=""media_image"" data-entity-type=""media"" data-entity-uuid=""78fccca1-3471-4615-8aca-748c89ae33d2"" data-langcode=""en"" title=""household-orchestra-step-3.png"" class=""embedded-entity"">  <img src=""/docroot/sites/default/files/2021-05/household-orchestra-step-3.png"" alt=""Illustration of Household orchestra Step 3"" title=""household-orchestra-step-3.png"" typeof=""foaf:Image"" /></div>
<p>Натяните несколько резинок на обувную коробку. Можно попробовать вырезать круглое отверстие по центру коробки, как на гитаре. Резинки разной толщины будут издавать звуки разной тональности, а еще звук будет отличаться в зависимости от размера коробки. Теперь в вашем оркестре есть струнная секция.</p>

<p>Шаг 4</p>

<div alt=""Illustration of Household orchestra Step 4"" data-embed-button=""media_browser"" data-entity-embed-display=""media_image"" data-entity-type=""media"" data-entity-uuid=""936b4852-9625-43fe-abc9-dbcd5b42bceb"" data-langcode=""en"" title=""household-orchestra-step-4.png"" class=""embedded-entity"">  <img src=""/docroot/sites/default/files/2021-05/household-orchestra-step-4.png"" alt=""Illustration of Household orchestra Step 4"" title=""household-orchestra-step-4.png"" typeof=""foaf:Image"" /></div>
<p>Дети могут исполнять разные партии в оркестру и с помощью электроприборов (под присмотром взрослых). Миксеры, чайники, пылесосы и стиральные машины создают отличный фоновый шум для ваших упражнений в музицировании.</p>

<p>Знаете ли вы, что слово «оркестр» происходит от греческого слова, означающего «танцевать»? Исполняя музыку, не отказывайте себе в удовольствии и потанцевать под нее!</p>

<p><strong>Чему при этом учится ребенок:  </strong>Дети любят шуметь! Дайте им возможность пошуметь вдоволь, чтобы понять, как что звучит и отличается по громкости. Это позволит детям задуматься о том, как возникают звуки и создается музыка, а также о том, что как звучит.</p>

<p> </p>

<p> </p>",11756,yes,parent,,38,7076,1,by-ru,draft
7526,"Маленький помощник","<p><strong>Что понадобится: </strong>Бумага и карандаш, полоски бумаги; список простых повседневных дел, которые может выполнить ваш ребенок, по одному делу на каждой полоске бумаги. Примеры: сложить одежду в корзину для белья, убрать журналы на столик, положить приборы на стол для завтрака, подмести в прихожей. (В зависимости от вашего быта и того, что умеет ваш ребенок).</p>

<p><strong>В чем заключается занятие: </strong>Поговорите с ребенком о том, что он растет и становится взрослее. Предложите ребенку выбрать дело, которое он может делать каждый день, тем самым помогая вам поддерживать порядок в доме. Можно зачитывать задания вслух по очереди с бумажек (или попросить ребенка закрыть глаза и достать одну наугад из мешка). Договоритесь о том, чтобы ребенок самостоятельно выполнял выбранную задачу в течение следующей недели или любого другого периода по договоренности. Можно предлагать новое дело на каждую следующую неделю (во многих дошкольных учреждениях есть такие же правила).</p>

<p>При необходимости покажите, как правильно делать и поначалу подсказывайте и подбадривайте ребенка. Хвалите ребенка за усердие. При этом рассказывайте, за что именно вы его хвалите — не просто «Ты молодец!», а «Ты сегодня очень тщательно вытер стол. Стало действительно чисто!» Особо хвалите ребенка за самостоятельность в выполнении заданий.</p>

<p><strong>Чему при этом учится ребенок: </strong>Ваш ребенок усвоит, что умение что-то делать самостоятельно — это важный навык для него и для всей семьи (а в дальнейшем и для класса и общества, в котором он будет находиться). Ваш ребенок отрабатывает многочисленные навыки, которые повышают уровень его самостоятельности (например, способность самостоятельно одеваться) и позволяют активно участвовать в быту семьи. Такая постепенная выработка самостоятельности — признак позитивного развития.</p>",12701,yes,parent,,38,7081,1,by-ru,draft
7531,"Полоса препятствий","<p><strong>Что вам понадобится: </strong>Картонные коробки; Надувной круг или матрас; Садовая мебель; Одеяла; Подушки; Мягкие игрушки; Обручи; Веревка</p>

<p><em>Дополнительно: </em>Секундомер</p>

<p><strong>В чем заключается занятие: </strong>Помогите своему ребенку/детям соорудить полосу препятствий в саду. Можно сложить в кучу разные предметы, такие как картонные коробки, одеяла, обручи, надувной круг и т.д., и пусть дети придумают, как их использовать. Через какие-то их них надо пробраться, что-то перепрыгнуть, под чем-то проползти... Что-то можно попытаться удержать на голове, вращая обруч. После того, как дети соорудят свою полосу препятствий с заданиями и опробуют ее, можно соревноваться всем вместе на время или вводить дополнительные правила.</p>

<p>Начать лучше с простого — с картонных коробок и надувных предметов. Дальше подумайте, как можно использовать мягкие игрушки, обручи, мячи или даже одеяло. Встаньте в центре, пусть дети организуют препятствия вокруг вас. Пусть задания будут разнообразными — какие-то предметы нужно перелазить, какие-то перепрыгивать, под какие-то подлезть, сквозь какие-то пробираться. Когда вы закончите, протестируйте получившуюся полосу препятствий! Засеките время секундомером, а потом старайтесь улучшить свой результат.</p>

<p><strong>Чему при этому учиться ребенок: </strong>Строить полосу препятствий на улице — это увлекательное, веселое, активное занятие. Ну и что, что ребенок немного перепачкается! Все, что нужно — это легкие, простые и безопасные предметы, например, картонные коробки и подушки. Такие активные игры развивают воображение, стимулируют когнитивные навыки и повышают силу и ловкость, ведь дети карабкаются, бегают и ползают.</p>",12086,yes,parent,,38,7086,1,by-ru,draft
