ID,Title,Body,Cover_image,Equipment,Type_of_support,Child_age,Domain,Related_milestones,Mandatory_content,Translation_language,Moderation_state
7616,Музыкальные уста,"<p><strong>Необходимые материалы: </strong>Мягкое одеяло и губная гармоника, рог или рулон туалетной бумаги (все по желанию).</p>

<p><strong>Что вы можете делать вместе: </strong>Воспользуйтесь лучшим музыкальным инструментом, который есть у вас дома: Ваши уста, младенцы любят слышать разные звуки и проводить время с мамой и папой; какая хорошая активность, в которой можно объединить оба аспекта.</p>

<p>Для начала вы можете положить ребенка на мягкое одеяло или положить на колени, чтобы он мог видеть ваше лицо.</p>

<p>Пора начинать играть и начинать издавать звуки ртом: громкие поцелуи, щелчки языком, вибрация губ, имитирующий звук двигателя, рычание, крик, свист, пение или жужжание.</p>

<p>Вы также можете имитировать звуки животных; утка, собака, кошка, лошадь, корова, свинья, курица, петух, обезьяна, змея, птица, осел, волк и многие другие.</p>

<p>Предположим, вы чувствуете, что вашему ребенку очень нравятся звуки. В этом случае вы можете добавить инструменты для того чтобы видоизменить звуки, например губную гармошку, рог, самодельный мегафон ( из рулона туалетной бумаги) и другие.</p>

<p>Всегда следите за тем, чтобы инструменты, которые вы используете, не были опасны для вашего ребенка. Избегайте слишком громких звуков, так как вы можете расстроить ребенка и заставить его чувствовать себя некомфортно. Если вам кажется, что какой-то звук звучит неудобно, не повторяйте его.</p>

<p><strong>Чему учится ваш ребенок: </strong>С помощью этой активности вы поможете своему ребенку различать и определять местонахождение звуков, исходящих извне, а также научить его воспроизводить звуки, облегчая развитие речи.</p>",12406,no,parent,,6441,2576,1,ru,published
7621,Фигуры на потолке,"<p><strong>Необходимые материалы: </strong>Пеленка для пеленания или поверхность, чтобы уложить ребенка; Надувной мяч или детская подвесная игрушка; Фигурки из цветной бумаги и скотч. </p>

<p><strong>Что вы можете делать вместе: </strong>Когда ваш ребенок очень маленький, вы должны использовать любой момент, чтобы стимулировать его и развивать его навыки. В этот раз вы поможете малышу развивать моторику.</p>

<p>Вы можете повесить надувной мяч, подвесную игрушку или фигурки из цветной бумаги к потолку прямо над местом, где вы переодеваете малыша. Объект должен висеть на таком расстоянии, чтобы вы могли дотронуться до него, но ребенок не смог.</p>

<p>Если малышу меньше двух месяцев, лучше повесить предмет на расстоянии 30 см между ребенком и подвесной игрушкой. Если ваш малыш немного старше, вы можете оставить расстояние до 90 см.</p>

<p>Пора сменить подгузник! Положите ребенка на пеленальный столик и обратите его внимание на висящий объект. Понаблюдайте за ним некоторое время, пока меняете подгузникНемного подвигайте висящий мяч, подвесную игрушку или фигурки и понаблюдайте за реакцией малыша.</p>

<p>Ваш малыш будет очарован и, скорее всего, попытается дотянуться до него. Позвольте ему попробовать и поощрите за попытку.</p>

<p>Когда вы закончите менять подгузник, возьмите ребенка на руки и поднесите его ближе к объекту. Позвольте малышу прикоснуться к нему и посмотреть на него под разными углами.</p>

<p><strong>Чему учится ваш ребенок:  </strong>С помощью этого упражнения ваш ребенок укрепит мышцы шеи, головы, туловища и рук, что поможет ему ползать и ходить, когда придет время. Это также будет стимулировать зрение, концентрацию и творческие способности малыша.</p>",12356,yes,parent,,6441,2591,1,ru,review_after_translation
7626,Моя первая погремушка,"<p><strong>Необходимые материалы: </strong>Детская погремушка, мягкая поверхность или детское кресло.</p>

<p><strong>Что вы можете делать вместе: </strong>Младенцам нравятся песни, поскольку это интересный способ познакомиться с миром звуков и языка. Выполняя эту активность, вы поможете своему ребенку научиться распознавать звуки окружающей среды.</p>

<p>Перед началом подготовьте место, где ребенок будет играть. Уберите все отвлекающие факторы, которые могут повлиять на игру. Для начала вам необходимо иметь под рукой погремушку вашего ребенка.</p>

<p>Теперь положите ребенка на мягкую поверхность или посадите в детское кресло. Держите погремушку перед малышом и осторожно встряхните. Будьте осторожны, не встряхивайте погремушку сильно, чтобы ребенок не испугался.</p>

<p>Потрясите погремушкой, спойте детскую песенку или попробуйте следующее:</p>

<p>У старого Макдональда была ферма, ИяИяоо..</p>

<p>И на той ферме у него было несколько уток, ИяИяоо..</p>

<p>Кря - кря здесь и кря- кря там</p>

<p>Кря-кря здесь, кря-кря там, везде кря-кря!</p>

<p>У старого Макдональда была ферма, ИяИяоо..</p>

<p>Вы можете использовать эту рифму, добавляя различных животных, например собак, кошек и тд. Убедитесь, что ваш ребенок смотрит на погремушку, и посмотрите, привлекла ли она его внимание. Если это так, отодвиньте погремушку в сторону и снова спойте песню, чтобы ваш ребенок мог повернуть голову к погремушке.</p>

<p>Продолжайте трясти погремушкой в разных частях комнаты и наблюдайте, как ваш ребенок следит за звуком головой. Будьте осторожны, чтобы не дребезжать в местах, представляющих опасность для шеи ребенка при повороте головы.</p>

<p>Если вы чувствуете, что ваш ребенок заинтересован и готов, вы можете дать ему погремушку, чтобы он взял ее в руку и поэкспериментировал с ней. Вы можете продолжать петь детские песенки, пока ваш ребенок играет с погремушкой.</p>

<p><strong>Чему учится ваш ребенок: </strong>Мозг ребенка развивается и растет благодаря информации, которую он получает из окружающей среды. Воздействие на него различных звуков поможет ему распознавать, различать и определять откуда исходит звук, а также двигать шеей и головой.</p>",12421,yes,parent,,6441,2596,1,ru,review_after_translation
7631,Мои первые перевороты,"<p><strong>Необходимые материалы: </strong>Не требуется</p>

<p><strong>Что вы можете делать вместе: </strong></p>

<p>Постепенно младенцы лучше узнают свое тело и начинают координировать движения, которые позволяют им открывать мир вокруг себя. Активная практика этого упражнения поможет малышу освоить навык переворачивания в кратчайшие сроки. Для начала вам нужно всего лишь уложить малыша на спину на мягкую поверхность, например на кровать. Возьмите одну ногу малыша и перекиньте через другую. Повторите то же самое с другой ногой. Повторите примерно три таких скрещивания, а в четвертый раз положите свою вторую руку под спину малыша и помогите ему перевернуться, аккуратно направляя, пока он не окажется на животе.</p>

<p>Во время выполнения упражнений вы можете читать стишок:</p>

<p>Круглый и круглый, и ты изменишься</p>

<p>Что ты видишь</p>

<p>Круглый, круглый, ты дашь</p>

<p>Только ты увидишь!</p>

<p>Помните, чтобы избежать болезненных ощущений у малыша, все движения должны быть деликатными, и он уже должен самостоятельно держать голову.</p>

<p>Снова положите малыша на спину и повторите упражнение, переворачивая его уже с другой стороны тела. Поговорите с малышом, чтобы привлечь его внимание с той стороны куда он перевернулся, повторяя при этом четверостишие. Завершайте упражнение множеством поцелуев.</p>

<p><strong>Чему учится ваш ребенок:</strong></p>

<p>Помогает малышу приобрести силу и скоординированность движений, чтобы переворачиваться со спины на животик, которая позволит ему приобрести необходимые навыки координации для дальнейшей двигательной активности через несколько месяцев.</p>",12426,no,parent,,6441,2601,1,ru,published
7636,Ты можешь достать это,"<p><strong>Необходимые материалы: </strong>Мягкая яркая игрушка</p>

<p><strong>Что вы можете делать вместе: </strong>Первое, что нужно сделать, это убедиться, что на мягкой поверхности, на которой будет заниматься ваш ребенок, нет предметов, которые могли бы его отвлекать. Теперь положите его лицом вниз и встаньте на колени перед его ногами.</p>

<p>Поставьте перед малышом мягкую яркую игрушку и привлеките его внимание, чтобы он устремил взгляд на игрушку. Вы можете немного переместить игрушку, чтобы привлечь внимание малыша.</p>

<p>Когда вы видите объект, ваш ребенок будет пытаться дотянуться до него, двигать головой и вытягивать руки. Если ваш ребенок очень маленький, вы, вероятно только увидите попытку пошевелить головой и руками.</p>

<p>Повторяйте это упражнение утром и днем, и по прошествии нескольких недель вы сможете усложнить упражнение. Когда вы увидите, что ваш ребенок может двигать головой и вытягивать руки, чтобы дотянуться до игрушки, осторожно придержите его ноги, чтобы он тянулся с большей силой.</p>

<p>Помните, что ваш ребенок нежный, и вы должны относиться к нему осторожно, чтобы не причинить вреда. Если вы заметили, что ваш ребенок устал, остановите игру.</p>

<p>Упражнения на силу и тонус мышц способствуют развитию мозга, что поможет вашему ребенку лучше контролировать свои движения. Используя яркий предмет, вы будете стимулировать зрение вашего ребенка.</p>

<p><strong>Чему учится ваш ребенок: </strong>С помощью этого легкого упражнения вы поможете своему ребенку стимулировать мышечный тонус, что позволит ему позже сидеть, ползать и ходить.Один из наиболее важных аспектов развития крупной моторики поможет вашему ребенку передвигаться и быстро познавать мир.</p>",12476,yes,parent,,6441,2601,1,ru,review_after_translation
7641,Я вижу себя в зеркале,"<p><strong>Необходимые материалы: </strong>Зеркало</p>

<p><strong>Что вы можете делать вместе: </strong>Во время этой активности ваш малыш научится узнавать себя через зрительное восприятие, то есть глядя в зеркало.</p>

<p>Для этого упражнения сядьте рядом со своим малышом, чтобы вы могли произносить такие утверждения, как «этот малыш - это ты», «мама рядом с тобой», «какой милый малыш», «это твой нос», « это твой ротик».</p>

<p>Подумайте о других утверждениях, которые могут помочь вашему малышу.</p>

<p><strong>Чему учится ваш ребенок: </strong>Все это поможет вашему ребенку научиться определять и развивать движения тела посредством наблюдения и узнавать вас в зеркале.</p>",12366,yes,parent,,6436,2611,1,ru,review_after_translation
7646,Демонстрация эмоций,"<p><strong>Необходимые материалы: </strong>Не требуется</p>

<p><strong>Что вы можете делать вместе: </strong>Перед тем, как начать активность, убедитесь, что вы подготовили место для использования с вашим малышом. Вы можете разместить ребенка в удобном месте, в кресле или посадить на колени лицом к вам. Вы также можете делать это во время смены подгузника или купания.</p>

<p>Начните активность, играя с малышом, выражая радость, безмятежность, гордость, веселье, изумление, любовь, открывая глаза, рот, поднимая брови, целуя его, лаская, обнимая и тд. Включите звуки, чтобы ваш малыш мог их распознать и проявить привязанность. Выражайте чувства и ждите, пока  малыш отреагирует на каждое из них.</p>

<p><strong>Чему учится ваш ребенок:  </strong>С помощью этой активности вы научите малыша распознавать эмоции других людей и реагировать на них.</p>",12451,no,parent,,6431,2621,1,ru,review_after_translation
7651,Маленькие хлопки руками,"<p><strong>Необходимые материалы: </strong>Мягкое одеяло или стул (по желанию), песни и рифмы</p>

<p><strong>Что вы можете делать вместе: </strong>С первых дней жизни ребенок начинает учиться узнавать свое тело и управлять им, и, хотя это процесс, который требует времени, присматриваясь вы увидите, как ваш малыш пытается удержать свои крошечные ручки. С помощью этих игр вы можете помочь ему улучшить свои моторные навыки.</p>

<p>Перед тем как начать, вы должны подготовить место для игры. Положите одеяло или стул на удобную поверхность. Положите ребенка на одеяло и сядьте рядом с ним, чтобы он мог вас видеть. Начните с пения песен или стишков, пока играете его руками и пальцами. Вы можете попробовать одну из следующих игр:</p>

<p><strong>Если ты счастлив</strong></p>

<p>Если ты счастлив, хлопай в ладоши (хлопайте в ладоши).</p>

<p>Если ты счастлив, хлопай в ладоши (хлопайте в ладоши).</p>

<p>Если ты счастлив и знаешь это, твои руки это узнают.</p>

<p>Если ты счастлив, хлопай в ладоши (хлопайте в ладоши).</p>

<p>Вы можете использовать имя ребенка, когда он захочет. Не забывайте держать и двигать руками ребенка очень осторожно и деликатно.</p>

<p><strong>Чему учится ваш ребенок: </strong>Эта активность помогает вашему малышу развить координацию глаз и руки, контроль над моторикой и начать социальное взаимодействие с помощью лепета.</p>

<p> </p>",12381,yes,parent,,6441,2631,1,ru,review_after_translation
7656,Назови мое имя,"<p><strong>Необходимые материалы: </strong>Не требуется</p>

<p><strong>Что вы можете делать вместе: </strong>Чтобы заняться этой прекрасной активностью, вам нужно всего лишь положить малыша на спину на мягкую поверхность, например в его кроватку. Теперь поговорите со своим малышом, чтобы привлечь его внимание. Когда вы это сделаете, вы можете спеть ему следующую песенку:</p>

<p>Где (произнесите имя вашего малыша)?</p>

<p>Где (произнесите имя вашего малыша)?</p>

<p>""А вот и ты"".</p>

<p>Затем вы можете варьировать, произнося это громко и тихо. Еще один способ помочь ребенку узнать свое имя, ваш голос и место откуда исходит звук. Вы можете расположиться в разных сторонах кровати или колыбели и спеть оттуда песенку. Пойте имя малыша, пока он не обернется и посмотрит, где вы находитесь. Всегда заканчивайте, говоря своему малышу: «Я люблю тебя (произнесите имя малыша)!» и поцелуйте его.</p>

<p><strong>Чему учится ваш ребенок: </strong>Эта активность поможет малышу научиться узнавать свое имя и использовать движения тела в ответ на знакомые слова.</p>",12436,no,parent,,6441,2641,1,ru,review_after_translation
7661,Двигательные упражнения,"<p><strong>Необходимые материалы: </strong>Игрушки разного размера и фактуры или мягкое одеяло</p>

<p><strong>Что вы можете делать вместе: </strong>Перед тем как начать, обязательно подготовьте место. Вы можете разместить  малыша в удобном месте перед собой, на коврике, на кровати или в кресле.</p>

<p>Чтобы начать активность, вы можете подготовить руки своего ребенка, сделав небольшой массаж, чтобы он мог реагировать на ваши стимуляции. Затем вы можете дать малышу игрушку, чтобы он почувствовал ее, а затем поместите игрушку на небольшом расстоянии, чтобы малыш попытался дотянуться до нее.</p>

<p>Если у вас нет игрушек, можно использовать мягкое одеяло, чтобы малыш пытался дотянуться до одеяла. Не забывайте подбадривать и праздновать его достижения.</p>

<p><strong>Чему учится ваш ребенок: </strong>С помощью этой активности вы поможете малышу дотягиваться до предметов одной рукой, используя зрительно-моторную координацию.</p>",12401,yes,parent,,6421,2646,1,ru,review_after_translation
