ID,Title,Body,Child_age,Related_articles,Related_video_articles,Related_activities,Translation_language,Moderation_state
7091,"Is able to make complex shapes, letters, and detailed drawings","<p>Can put realistic details in a drawing, makes more complex pictures, uses drawing and painting materials skillfully if has an opportunity. </p>",58,,,7536,en,published
7096,Speaks in complex sentences,"<p>The sentences are more and more complex. For example, the child uses the present, past and future tenses correctly.</p>",58,,,7541,en,published
7101,Recognizes letters of the alphabet and has some reading skills,"<p>Can recognize most letters of the alphabet and can read basic everyday words and syllables such as a shop, a book, ma-ma, da-da etc. </p>",58,,,7546,en,published
7106,Tells a complete story,"<p>The child manages to retell the plot of a certain story completely independently and accurately, correctly arranging the events in chronological order, the event in which he/she participated, or a TV show.</p>",58,,,7826,en,published
7111,"Knows her/his name and surname, age, and home address",<p>He/she knows basic information about himself/herself and can reproduce it on request. </p>,58,,,7551,en,published
7116,Understands what happens at different times and how time passes,"<p>Understands the passage of time, understands what happens in the morning, at noon and in the evening, can plan some activities.</p>",58,,,7851,en,published
7121,Follows rules of games and sometimes has ideas for new rules,"<p>He/she understands the rules that have been set (for example, the Rules of the Game), but occasionally he/she wants to add some new, different ones. </p>",58,,,7561,en,published
7126,Shows signs of taking responsibility,"<p>For example, he/she begins to take care of his/her own things.</p>",58,,,7566,en,published
7131,Shows understanding of difference between real and pretend or make-believe,"<p>He/she only invents stories, events, characters from his/her imagination, artistically presents, describes, and assigns them properties that are not realistic. He/she has fun while doing it, aware that everything is possible in the world of imagination. </p>",58,,,7571,en,published
7136,Has understanding of other people’s ideas and needs,<p>That is why he/she pays more attention to what others want or suggest and wants to meet them – he/she is more cooperative with friends and in team functioning.</p>,58,,,7576,en,published