ID,Title,Body,Child_age,Related_articles,Related_video_articles,Related_activities,Translation_language,Moderation_state
2911,"Муундарды кайталайт, кээ бир балдар мааниси бар сөздөрдү айта алышат","<p>Көптөгөн ар кандай үндөрдү чыгарат (мааа, бааа, дааад ...) жана алардын айрымдарын алардын маанисин билген биринчи таанымал сөздөр катары колдонот (апа, ата ...).</p>",,6531,6531,,kg-ky,published
2916,Кыскача көрсөтмөнү же буйрукту түшүнөт,"<p>Ага ""топту алып кел"" же ""апага бер"" деп айтканыңызда түшүнөт.</p>",,6541,6541,,kg-ky,published
2921,"Жаңдоо кыймыл-аракетин туурап, колдонот","<p>Ал учурашуу үчүн ""па-па"" деп айта алат, ""жок"" дегенге башын чайкайт, өзү каалаган нерсени көрсөтөт.</p>",,"3566, 6521","3566, 6521",,kg-ky,published
2926,Бир нече жөнөкөй көрсөтмөлөрдү түшүнөт жана аткарат,"<p>Төмөнкүдөй бир же бир нече өз ара байланышкан жөнөкөй оозеки өтүнүчтөрдү аткара алат: ""Жаздык алып кел"", ""Кел, отур"", ""Муну челекке ыргытып сал"" ...</p>",,,,,kg-ky,published
2931,"Оюнчуктарды кызыгуу менен карап чыгат: аларды силкилдетет, кагыштырат, ыргытат, деталдарына көңүл бурат.",<p>Бири-бирине кагыштыруу же каккылоо (столго стаканды же оюнчукту башка оюнчукка каккылап) аркылуу буюмдарды изилдейт.</p>,,"3586, 6561","3586, 6561",,kg-ky,published
2936,"Манжалары менен майда нерселерди алат, манжалары менен тамактанат","<p>Мыкты ""кычкач кармагыч"" жөндөмгө ээ - өтө кичинекей буюмдарды манжасы жана сөөмөйү менен илип алып алектене алат.</p>",,"3571, 6536","3571, 6536",,kg-ky,published
2941,"Буюмдарды кутуга салып, кайра андан алып чыгат.","<p>Буюмдарды так иштетүү мүмкүнчүлүгүнө ээ. Ал тургай, кичинекей буюмдарды кутуга же бөтөлкөгө салып, кайра алып чыга алат.</p>",,"4761, 6846","4761, 6846",,kg-ky,published
2946,Башка балдар менен жанаша ойнойт,"<p>Башка балдардын жанында өз алдынча ойнойт, аларга кошулууга муктаж эмес, бирок алардын оюнун бузбайт, бара-бара аларды оюнга тарта башташы мүмкүн, мисалы, аларга оюнчук сунуштайт.</p>",,"6636, 3601","6636, 3601",,kg-ky,published
2951,"Эмеректерге таянып туруп, алардын тегерегинде баса баштайт.","<p>Ал колдоо менен турат же ал тургай, колдоосуз эле  кыска убакытка жалгыз тура алат. Ал эмеректерге таянып же чоң кишинин колун кармоо менен кыймылдоого аракет кылат.</p>",,"3346, 6556","3346, 6556",,kg-ky,published
2956,Чоңдордун жана улуу балдардын жүрүм-турумун туурайт,"<p>Чоңдорду туурап, алардан көргөн нерселерди жасайт, мисалы: колясканы түртөт, гезит окуйт ...</p>",,"6641, 3566","6641, 3566",,kg-ky,published
2961,Кийинүүдө жардам берет,"<p>Сиз аны кийининтип жатканда кызматташат, колун жеңине салып жана бутун шымына түртөт.</p>",,,,,kg-ky,published
2966,Барган сайын өз алдынча болуп баратат,"<p>Кээде буйруктарга каршылык көрсөтөт, ачууланат, башкаларды башкаргысы келет, урушат, буйрук берет, өзүнүн буюмдарын коргойт.</p>",,4781,4781,,kg-ky,published
2971,Сезимдерин билдире алат,"<p>Ар кандай сезимдерди билдире алат жана көрсөтө алат: коркуу, ачуулануу, боорукердик, күнөөкөрдүк, кубаныч.</p>",,"3656, 4731","3656, 4731",,kg-ky,published
2976,"Турат, кыймылдайт жана өз алдынча жүрөт.","<p>Ал өз алдынча ар кандай багытта, ар кандай ылдамдыкта кыймылдай алат же ар кандай кыймылдарды айкалыштыра алат (кыймылын токтотуп, колун булгалоо үчүн).</p>",,"4841, 4771, 6591","4841, 4771, 6591",,kg-ky,published
2981,Жөнөкөй буйруктарды түшүнөт жана аткарат,"<p>Жөн гана айтылган көрсөтмөлөрдү эч кандай демонстрациясыз аткарат, андан күтүлгөн нерселерди аткара алат.</p>",,"6571, 4776","6571, 4776",,kg-ky,published
2986,Сөздөрдү мааниси менен айтат.,"<p>Ал ата-энелерге кайрылганда, жок дегенде бир же бир нече жеке сөздөрдү сүйлөйт.</p>",,6851,6851,,kg-ky,published
2991,Дагы деле бейтааныш адамдардан жана жагдайлардан коркуу сезими байкалат,"<p>Бейтааныш адам менен байланышканда ал коркуу сезими менен кабыл алат, тааныш адамды издейт же ата-энесине жабышат.</p>",,"3601, 3646, 346","3601, 3646, 346",,kg-ky,published
2996,Ролдуу оюндарды ойногонду жакшы көрөт,"<p>""Ролдуу оюндарды"" ойнойт, ""туурамай оюн"" пайда болот, ал чай ичкендей түр көрсөтөт, куурчакты тойгузат ж.б.</p>",,"6576, 2161, 2141, 4786","6576, 2161, 2141, 4786",,kg-ky,published
3001,Карандаш же бор менен кагазга өз алдынча чиймелейт,"<p>Кагазга карандаш менен, кумга колу менен, балчыкка таяк менен же бетонго суу менен жазып жаткансып чиймелегенди жакшы көрөт. </p>",,"3571, 6606","3571, 6606",,kg-ky,published
3006,Күнүмдүк турмушка керектүү буюмдарды колдонууну билет,"<p>Кашык, тиш щёткасы, телефон сыяктуу нерселерди колдонуу боюнча көнүмдөрүн көрсөтөт.</p>",,"3991, 6601","3991, 6601",,kg-ky,published
3011,Бир буюмду экинчисине салат,"<p>Буюмдарды идишке же чыныга салып, андан кайра аларды алып чыгат. </p>",,"2116, 1986, 6586","2116, 1986, 6586",,kg-ky,published
3016,Сүйлөшүп жатып ал өз ара жакшы түшүнүшүү үчүн жаңсоолорду колдонот,"<p>Ал чоңдор жасаган жаңсоолорду жана алардын айткан сөздөрүн туураганга аракет кылат. Суроолорго ылайык ишараттарды жетиштүү түрдө колдонот (""кош"" же ""жок"").</p>",,"6596, 4776","6596, 4776",,kg-ky,published
3021,Биргелешкен иш-чараларды күтөт,"<p>Ал мимиканы, жаңсоолорду жана жакын адамдардын айрым иш-аракеттерин туурап, сөөмөйү менен аны кызыктырган нерсени көрсөтөт же башка адамдарга аларды кызыктыруу жана оюнга тартуу үчүн бир нерсе сунуш кылат.</p>",,"3646, 6581","3646, 6581",,kg-ky,published
5861,Китептерге көбүрөөк кызыгуу көрсөтөт,"<p>Сүрөттүү китептерге кызыгуу көрсөтөт, катуу мукабалуу китепченин барактарын өз алдынча ача алат.</p>",,6806,6806,,kg-ky,published
6971,Башка балдар жана чоңдор менен ойноого кызыгуусун көрсөтөт,"<p>Башкаларды ойноо үчүн издейт, оюнга кандайча аралашууну билет жана ойногондо башка балдардан жана чоңдордон үйрөнөт.</p>",,,,,kg-ky,published
6976,Башкаларды ыраазы кылуу жана кызматташуу жагат,<p>Башкалардын сезимдерин тааныйт; көп учурда башкалар менен бөлүшкөндү жакшы көрөт; кезектеше алат. </p>,,,,,kg-ky,published
6981,4-5 сөздөн турган сүйлөмдөрдү колдонот,<p>Сөздөрдү маанилүү жана оюн жеткире турган жолдор менен бириктирет.</p>,,,,,kg-ky,published
6986,2 жана 3 сандарынын маанисин түшүнөт,"<p>Эгер ага айтса же сураса, эки-үч нерсени тандай алат (оюнчуктарды, кашыктарды ж.б.) же бир нерселердин топтомун карап, экөө же үчөө деп айта алат.</p>",,,,,kg-ky,published
6991,"""Бирдей"" же ""окшош"" жана ""ар кандай"" деген сөздөрдү түшүнөт жана нерселерди ар кандай жолдор менен топтой алат (мисалы, түсү же көлөмү боюнча)","<p>Мисалы, бала жүндүү жаныбарлар жана мамык жүндүү жаныбарлар жөнүндө сүйлөшүшү мүмкүн; бала китепте башкалардан айырмаланып турган бир нерсени көрсөтүшү мүмкүн (мисалы, бир гана бала топ кармап турат).</p>",,,,,kg-ky,published
6996,"Чыныгы, жасалма же элестүү нерселердин негизги айырмачылыктарын билет",<p>Ал жок каарман жөнүндө сюжет түзөт же жаныбарлар чыныгы жашоодо сүйлөй албасын билет.</p>,,,,,kg-ky,published
7001,Анын жашоосунда болуп жаткан нерселер жөнүндө сүйлөшөт,<p>Өткөн жумада болгон туулган күн кечеси жөнүндө айтып бере алат же үй-бүлөсү менен болгон сапарын сүрөттөй алат.</p>,,,,,kg-ky,published
7006,Ырларды ырдайт же жаттап алган окуяларды айтып берет,"<p>Мурун уккан окуя же ыр жөнүндө ойлонуп, сөздөрдү эстөөгө аракет кылат.</p>",,,,,kg-ky,published
7011,Алфавиттин айрым тамгаларын жаза алат же ага башка сүрөттөрдү  алдын-ала көрсөтсө көчүрүп жазууга аракет кылат,"<p>Тамгаларды же буюмдардын сүрөттөрүн карап, туура эмес көрүнсө дагы, аларды көчүрүүгө аракет кылат.</p>",,,,,kg-ky,published
7016,Манжалары менен колдорун тагыраак колдонот,"<p>Кайчыны колдонууда көбүрөөк чеберчиликти көрсөтөт; мунараларды курат (мисалы, 8 же андан көп чоң блоктордон). </p>",,,,,kg-ky,published
7021,Эрежелери менен жөнөкөй оюндарды ойнойт,"<p>Оюндардын жөнөкөй эрежелерин сактайт, кезек күтөт. </p>",,,,,kg-ky,published
7026,"Басат, чуркайт, секирет, ыргытат жана чоң жана кичине топторду оңой эле чеберчилик менен тебет","<p>Денени билгичтик менен колдонот (мисалы, бар болсо - скутер же велосипед, дөңгөлөктүү коньки ж.б. тебет).</p>",,,,,kg-ky,published
7031,Көптөгөн иш-аракеттерде денени билгичтик менен колдонот,"<p>Бир бутта турат, секирет, селкинчек тебет, тырмышып-жармашып чыгат. Мүмкүнчүлүк болсо, велосипед же скутер айдайт, топту бир гана колдорун же буттарын гана колдонуп, чеберчилик менен башкара алат.</p>",,,,,kg-ky,published
7036,Адам денесинин так сүрөтүн жана жөнөкөй формаларды тартат,"<p>Адамдын денесин дене мүчөлөрү көрүнүп тургандай кылып тартат; тегерек, үч бурчтук жана башка геометриялык фигураларды тарта алат. </p>",,,,,kg-ky,published
7041,"Беш же андан көп сөздөн турган сүйлөмдөр менен сүйлөйт; сөздөрдү колдонуп, келечек жөнүндө сүйлөшөт","<p>Өз оюн билдирүү үчүн сөздөрдү бириктирет; келечекте эмне ""болот"" же ""болушу мүмкүн"" деп айта алат.</p>",,,,,kg-ky,published
7046,Аңгемени же окуянын бир бөлүгүн айтып берет,"<p>Чоңдордун сунушу менен, жомоктун негизги маанисин же окуянын сүйүктүү бөлүгүн өз алдынча  айтып берет.</p>",,,,,kg-ky,published
7051,Атын жана дарегин айта алат,"<p>Эгер сураса, өзү жөнүндө негизги маалыматтарды айта алат. </p>",,,,,kg-ky,published
7056,"Онго чейин санап, он буюмду катасыз атай алат","<p>Ошондой эле 10 чейин ""биринчи, экинчи"" деп айта алат, жума күндөрүн жана айларды эсептей алат.</p>",,,,,kg-ky,published
7061,Кеминде төрт түстү туура атайт,"<p>Түстөрдү таануу кызгылт көк жана кызгылт сары (жөн гана кызыл, сары, көк эмес) сыяктуу кээ бир түстөрдү камтыйт. </p>",,,,,kg-ky,published
7066,Мурун жана кийин сыяктуу убакыт түшүнүктөрүн түшүнөт,"<p>Окуяга чейин жана андан кийин эмне болгонун түшүндүрөт; мезгилдерди ирээтке келтире алат (мисалы, жаздан кийин жай). </p>",,,,,kg-ky,published
7071,Күнүмдүк буюмдар кандайча колдонуларын түшүндүрө алат,<p>Телефон же акча сыяктуу нерселер күнүмдүк жашоодо кандайча колдонуларын түшүндүрөт.</p>,,,,,kg-ky,published
7076,Чыгармачылык иш-чараларга катышууну тандайт,"<p>Ырдоо жана бийлөө, сүрөт тартуу жана боё, чопо же башка материалдар менен моделдөө жана башка чыгармачылык иш-аракеттерге катышат.</p>",,,,,kg-ky,published
7081,Күнүмдүк жана коомдук иштерге өз алдынча катышуу көндүмдөрүн колдонот,"<p>Өз алдынча кийинип, чечине алат, кашык жана вилканы колдонот, ажаткананы өзү колдонот жана колун жууйт. Ата-энелерден бөлүнүп, өз алдынча коомдук иштерге катыша алат. </p>",,,,,kg-ky,published
7086,Өнүккөн физикалык көндүмдөрдү талап кылган ар кандай иш-чараларга чеберчилик менен катышат,"<p>Бир бутта туруп, топту так тээп, бутага топту тээп тийгизе алат ж.б. </p>",,,,,kg-ky,published
7091,"Татаал фигураларды, тамгаларды жана деталдуу чиймелерди жасай алат.","<p>Мүмкүнчүлүк болсо,чиймеге реалдуу деталдарды кошо алат, татаал сүрөттөрдү тартат, чийме жана сүрөт материалдарын чеберчилик менен колдонот. </p>",,,,,kg-ky,published
7096,Татаал сүйлөмдөр менен сүйлөйт,"<p>Сүйлөмдөр барган сайын татаалдашып баратат. Мисалы, бала учур, өткөн жана келээр чактарды туура колдонот.</p>",,,,,kg-ky,published
7101,Алфавит тамгаларын тааныйт жана анча-мынча окуу жөндөмүнө ээ,"<p>Алфавиттин көпчүлүк тамгаларын тааныйт жана ""дү-көн, ки-теп, а-па, а-та"" ж.б.у.с күнүмдүк сөздөрдү жана муундарды окуй алат. </p>",,,,,kg-ky,published
7106,Окуяны толук айтып берет,"<p>Бала белгилүү бир окуянын мазмунун толугу менен,  өзү катышкан окуяны же телекөрсөтүүнү хронологиялык тартипте туура уюштуруп, өз алдынча жана так айтып берүүгө жетишет.</p>",,,,,kg-ky,published
7111,"Аты-жөнүн, фамилиясын, жашын жана үйдүн дарегин билет",<p>Ал өзү жөнүндө негизги маалыматтарды билет жана аларды суроо-талап боюнча айта алат. </p>,,,,,kg-ky,published
7116,"Ар кандай мезгилдерде эмне болгонун, убакыт кандай өтүп жаткандыгын түшүнөт","<p>Убакыттын өтүшүн түшүнөт, эртең менен, түштө жана кечинде эмне болорун түшүнөт, кандайдыр бир иш-чараларды пландаштыра алат.</p>",,,,,kg-ky,published
7121,Оюндун эрежелерин сактайт жана кээде жаңы эрежелер боюнча идеялары болот,"<p>Ал бекитилген эрежелерди түшүнөт (мисалы, Оюндун Эрежелери), бирок анда-санда жаңы, ар кандай эрежелерди киргизгиси келет. </p>",,,,,kg-ky,published
7126,Жоопкерчиликти алуунун белгилерин көрсөтөт,"<p>Мисалы, ал өзүнүн буюмдарына өзү кам көрө баштайт.</p>",,,,,kg-ky,published
7131,Чыныгы жана жасалма же ойдон чыгарылган нерселердин айырмасын түшүнгөндүгүн көрсөтөт,"<p>Ал аңгемелерди, окуяларды, оюндагы каармандарды ойлоп таап, аларды көркөм чагылдырат, сүрөттөйт жана аларга реалдуу эмес касиеттерди ыйгарат. Элестетүү дүйнөсүндө бардыгы мүмкүн экендигин билип, аны аткарып жатып ырахат алат.</p>",,,,,kg-ky,published
7136,Башка адамдардын оюн жана муктаждыктарын түшүнөт,"<p>Ошондуктан ал башкалардын каалаган же сунуш кылган нерселерине көбүрөөк көңүл буруп, аларга жооп берүүнү каалайт - достору менен жана команданын иштешинде көбүрөөк кызматташат.</p>",,,,,kg-ky,published